{
  "$schema": "./step_schema.json",
  "flow_id": "scheduled_stock_analysis",
  "version": "v0.5.0",
  "run_type": "scheduled_stock_analysis",
  "fixed_flow": true,
  "permission_mode": "write_allowed",
  "description": "Fixed scheduled stock analysis DAG. MainAgent may execute, retry, or stop expert steps, but cannot replace them with lower-level tools.",
  "steps": [
    {
      "step_id": "data_inspection",
      "order": 1,
      "expert_agent": "DataInspectionAgent",
      "skill_id": "inspect_data_readiness",
      "description": "Check data freshness, completeness, PIT validity, provider state, and run required deterministic sync when allowed.",
      "required_artifacts": [],
      "produced_artifacts": [
        "data_readiness",
        "sync_result",
        "guardrail_decision",
        "reflection_report"
      ],
      "guardrails": [
        "plan",
        "tool",
        "output"
      ],
      "retry_policy": {
        "max_attempts": 2,
        "retryable_statuses": [
          "partial",
          "blocked"
        ]
      },
      "frontend_projection": {
        "label": "数据检查",
        "visible": true
      }
    },
    {
      "step_id": "quant_analysis",
      "order": 2,
      "expert_agent": "QuantAgent",
      "skill_id": "run_ml_lifecycle_quant_analysis",
      "description": "MLQuantWorker freezes the effective profile, runs the deterministic weighted-signal serving implementation on PIT-safe data, and emits passed candidates with base weights.",
      "required_artifacts": [
        "data_readiness"
      ],
      "produced_artifacts": [
        "quant_result",
        "analysis_mart_snapshot",
        "guardrail_decision",
        "reflection_report"
      ],
      "guardrails": [
        "plan",
        "tool",
        "output"
      ],
      "retry_policy": {
        "max_attempts": 1,
        "retryable_statuses": [
          "partial"
        ]
      },
      "frontend_projection": {
        "label": "量化分析",
        "visible": true
      }
    },
    {
      "step_id": "performance_growth_scout",
      "order": 2,
      "expert_agent": "PerformanceGrowthScoutAgent",
      "skill_id": "screen_growth_companies",
      "description": "Use structured PIT financial data to screen companies with strong recent performance growth before any RAG or WebSearch work.",
      "required_artifacts": [
        "data_readiness"
      ],
      "produced_artifacts": [
        "fundamental_target_pool",
        "guardrail_decision",
        "reflection_report"
      ],
      "guardrails": [
        "plan",
        "tool",
        "output"
      ],
      "retry_policy": {
        "max_attempts": 1,
        "retryable_statuses": [
          "partial"
        ]
      },
      "frontend_projection": {
        "label": "业绩筛选",
        "visible": true
      }
    },
    {
      "step_id": "rag_coverage_gate",
      "order": 3,
      "expert_agent": "RagCoverageGateAgent",
      "skill_id": "inspect_rag_coverage_and_refresh_if_needed",
      "description": "Check whether growth targets already have current RAG coverage; only missing, stale, or partial targets trigger disclosure/WebSearch refresh and indexing.",
      "required_artifacts": [
        "fundamental_target_pool"
      ],
      "produced_artifacts": [
        "rag_coverage_report",
        "disclosure_refresh_result",
        "indexed_document_batch",
        "guardrail_decision",
        "reflection_report"
      ],
      "guardrails": [
        "plan",
        "tool",
        "output"
      ],
      "retry_policy": {
        "max_attempts": 2,
        "retryable_statuses": [
          "partial",
          "blocked"
        ]
      },
      "frontend_projection": {
        "label": "RAG 覆盖",
        "visible": true
      }
    },
    {
      "step_id": "fundamental_analysis",
      "order": 4,
      "expert_agent": "FundamentalAnalystAgent",
      "skill_id": "analyze_fundamental_rag_evidence",
      "description": "EarningsCatalystWorker reads scoped RAG filings and the prior effective thesis during reporting windows or after a new filing is indexed, then performs counter-evidence WebSearch review.",
      "required_artifacts": [
        "fundamental_target_pool",
        "rag_coverage_report",
        "indexed_document_batch"
      ],
      "produced_artifacts": [
        "fundamental_thesis_snapshot",
        "fundamental_evidence_package",
        "guardrail_decision",
        "reflection_report"
      ],
      "guardrails": [
        "plan",
        "tool",
        "output"
      ],
      "retry_policy": {
        "max_attempts": 1,
        "retryable_statuses": [
          "partial"
        ]
      },
      "frontend_projection": {
        "label": "财报分析",
        "visible": true
      }
    },
    {
      "step_id": "sentiment_monitor",
      "order": 5,
      "expert_agent": "SentimentMonitorAgent",
      "skill_id": "monitor_thesis_sentiment_delta",
      "description": "Use bounded WebSearch for recent sentiment deltas that support, weaken, contradict, or leave unchanged the frozen fundamental thesis.",
      "required_artifacts": [
        "fundamental_thesis_snapshot"
      ],
      "produced_artifacts": [
        "sentiment_delta_report",
        "guardrail_decision",
        "reflection_report"
      ],
      "guardrails": [
        "plan",
        "tool",
        "output"
      ],
      "retry_policy": {
        "max_attempts": 1,
        "retryable_statuses": [
          "partial",
          "blocked"
        ]
      },
      "frontend_projection": {
        "label": "舆情校验",
        "visible": true
      }
    },
    {
      "step_id": "fusion_research",
      "order": 6,
      "expert_agent": "FusionResearchAgent",
      "skill_id": "fuse_quant_fundamental_and_sentiment",
      "description": "RecommendationFusionWorker combines MLQuantWorker and EarningsCatalystWorker artifacts, applies risk gates, preserves cash, and only then emits the Dashboard projection event.",
      "required_artifacts": [
        "quant_result",
        "analysis_mart_snapshot",
        "fundamental_thesis_snapshot",
        "sentiment_delta_report"
      ],
      "produced_artifacts": [
        "fusion_research_result",
        "dashboard_projection_event",
        "guardrail_decision",
        "reflection_report"
      ],
      "guardrails": [
        "plan",
        "tool",
        "output"
      ],
      "retry_policy": {
        "max_attempts": 1,
        "retryable_statuses": [
          "partial"
        ]
      },
      "frontend_projection": {
        "label": "融合研究",
        "visible": true
      }
    },
    {
      "step_id": "main_agent_final_review",
      "order": 7,
      "expert_agent": "MainAgent",
      "skill_id": "final_review",
      "description": "Review quant, fundamental, sentiment, fusion, guardrail, and dashboard artifacts. If incomplete, request a targeted expert retry or finish with a blocked state.",
      "required_artifacts": [
        "data_readiness",
        "quant_result",
        "analysis_mart_snapshot",
        "fundamental_thesis_snapshot",
        "sentiment_delta_report",
        "fusion_research_result",
        "dashboard_projection_event"
      ],
      "produced_artifacts": [
        "reflection_report",
        "guardrail_decision"
      ],
      "guardrails": [
        "final"
      ],
      "retry_policy": {
        "max_attempts": 1,
        "retryable_statuses": []
      },
      "frontend_projection": {
        "label": "最终复查",
        "visible": true
      }
    }
  ]
}
